₹4175,
₹6818,Colorful NVIDIA Mainstream 4 GB DDR3 Graphics Card
₹16999,Inno3D NVIDIA GTX 1050 Ti 4 GB GDDR5 Graphics Card
₹8784,Inno3D NVIDIA GEFORCE GT 1030 AERO ITX 2GD4 OC 4 GB GDD...
₹20701,MSI AMD/ATI Radeon RX 6500 XT MECH 2X 4G OC 4 GB GDDR6 ...
₹3199,Gamers Choice NVIDIA Geforce GT610-2D3 2 GB DDR3 Graphi...
₹23969,GIGABYTE AMD/ATI GV-R65XTEAGLE-4GD 4 GB GDDR6 Graphics ...
₹36750,ZOTAC NVIDIA RTX 3050 Twin Edge OC 8 GB GDDR6 Graphics ...
₹3599,ZEBRONICS NVIDIA ZEB-GT610 2 GB DDR3 Graphics Card
₹39278,ZOTAC NVIDIA RTX 2060 Twin Fan 12 GB GDDR6 Graphics Car...
₹43223,Inno3D NVIDIA GEFORCE RTX 3060 Twin X2 OC 12 GB GDDR6 G...
₹8400,ZOTAC NVIDIA GeForce GT 1030 2 GB DDR5 Graphics Card
₹19764,MSI NVIDIA GeForce GTX 1050 Ti 4GT OCV1 4 GB GDDR5 Grap...
₹3299,CONSISTENT NVIDIA Geforce GT 610 2 GB DDR3 Graphics Car...
₹37357,MSI AMD/ATI Radeon RX 6600 MECH 2X 8G 8 GB GDDR6 Graphi...
₹45535,MSI NVIDIA RTX 3060 GAMING 12 GB GDDR6 Graphics Card
₹39333,Colorful NVIDIA iGame Ultra 8 GB GDDR6 Graphics Card
₹7889,MSI NVIDIA N730K-4GD3 4 GB DDR3 Graphics Card
₹122657,ASUS NVIDIA ROG XG Mobile GC31S-022 GeForce RTX 3080 16...
₹22999,Colorful NVIDIA GTX 1650 NB 4GD6-V GDDR6 6 GB GDDR6 Gra...
₹30996,ZOTAC NVIDIA GAMING GeForce GTX 1660 SUPER Twin Fan 6 G...
₹6544,GALAX NVIDIA GEFORCE GT 730 4GB DDR3 4 GB GDDR3 Graphic...
₹22944,Colorful NVIDIA Battle AX 4 GB GDDR6 Graphics Card
₹49468,Inno3D NVIDIA GEFORCE RTX 3060 TWIN X2 12 GB GDDR6 Grap...
₹26589,GIGABYTE AMD/ATI GV-R65XTGAMING OC-4GD 4 GB GDDR6 Graph...
₹7449,ZOTAC NVIDIA GeForce GT 730 Zone Edition 4 GB DDR3 Grap...
₹62222,ZOTAC NVIDIA RTX 3070 Twin Edge LHR 8 GB GDDR6 Graphics...
₹699,Xsentuals NVIDIA PCIe Riser Adapter Card VER009S / 009S...
₹6290,Arktek NVIDIA NVIDIA GEFORCE GT 730 4GB 4 GB DDR3 Graph...
₹183333,ZOTAC NVIDIA RTX 3090 Trinity OC 24 GB GDDR6X Graphics ...
₹5999,GIGABYTE NVIDIA GeForce GT 730 2 GB DDR3 Graphics Card
₹7859,MSI NVIDIA GT 1030 AERO 2 GB DDR3 Graphics Card
₹211630,MSI NVIDIA RTX 3090 Ti GAMING X TRIO 24G 24 GB GDDR6X G...
₹44000,Colorful NVIDIA RTX3060 NB DUO 12G L-V 12 GB GDDR6 Grap...
₹21252,Inno3D NVIDIA GeForce GTX1050 TI 4 GB GDDR5 Graphics Ca...
₹63525,MSI NVIDIA GeForce RTX 3070 VENTUS 3X PLUS 8G OC LHR 8G...
₹3900,Colorful NVIDIA GeForce GT710-2GD3-V 2 GB GDDR3 Graphic...
₹63525,MSI NVIDIA GeForce RTX 3070 VENTUS 3X 8G OC LHR 8 GB GD...
₹36990,Colorful NVIDIA GEFORCE GTX 1660 super 6 GB GDDR6 Graph...
₹78589,Inno3D NVIDIA GEFORCE RTX 3070 Ti iChill X4 8 GB GDDR6X...
₹16999,GIGABYTE NVIDIA GV-N710D3-2GL 2 GB DDR3 Graphics Card
₹5999,Colorful NVIDIA Mainstream 4 GB DDR3 Graphics Card
₹699,Inno3D NVIDIA GTX 1050 Ti 4 GB GDDR5 Graphics Card
₹7859,Inno3D NVIDIA GEFORCE GT 1030 AERO ITX 2GD4 OC 4 GB GDD...
₹6544,MSI AMD/ATI Radeon RX 6500 XT MECH 2X 4G OC 4 GB GDDR6 ...
